{
  "base": "https://usnewsmap.com",
  "captured_at": "2026-10-07T06:20:28Z",
  "index_version": "pages-v20261006-2",
  "searches": {
    "bench: cross of gold 1896": {"bucket": {"count": 53, "from": "1896-01-01", "to": "1896-12-31", "unit": "week"}, "languages": {"dan": 1, "eng": 1570, "fre": 2, "ger": 12, "spa": 1}, "query": "q=cross+of+gold&mode=phrase&from=1896-01-01&to=1896-12-31", "series_hits": [3, 0, 0, 0, 0, 0, 0, 0, 0, 0, 0, 0, 0, 0, 1, 0, 1, 0, 0, 1, 1, 2, 0, 0, 0, 0, 0, 90, 157, 136, 122, 110, 149, 75, 67, 65, 51, 57, 77, 47, 76, 36, 59, 75, 27, 22, 16, 20, 8, 3, 6, 11, 0], "status": 200, "timing_ms": {"backend": 22556, "total": 22559}, "total": {"baseline_pages": 316327, "days": 167, "first_day": 71587, "hits": 1571, "last_day": 71950, "papers": 339, "places": 302}, "wall_s": 22.77},
    "bench: gold near silver": {"bucket": {"count": 228, "from": "1736-09-03", "to": "1963-12-31", "unit": "year"}, "languages": {"cho": 197, "chr": 5, "cze": 106, "dak": 2, "dan": 244, "eng": 1411916, "fin": 1, "fre": 5644, "ger": 4112, "haw": 2357, "heb": 2, "hrv": 3, "hun": 13, "ita": 143, "jpn": 485, "lit": 1, "nav": 1, "nor": 31, "pol": 81, "rum": 7, "slv": 3, "spa": 8842, "srp": 94, "swe": 27, "yid": 183}, "query": "q=gold+silver&mode=near&near=5", "series_hits": [4, 15, 6, 2, 0, 0, 0, 0, 0, 1, 0, 0, 0, 0, 0, 2, 2, 0, 2, 0, 2, 7, 7, 10, 7, 19, 34, 14, 30, 14, 22, 28, 26, 34, 4, 26, 73, 79, 127, 117, 89, 93, 88, 139, 160, 352, 153, 74, 42, 31, 49, 136, 226, 25, 45, 53, 48, 45, 78, 119, 128, 105, 71, 42, 128, 97, 108, 282, 171, 146, 157, 147, 108, 114, 234, 338, 270, 373, 296, 668, 875, 400, 587, 608, 581, 479, 468, 533, 522, 602, 638, 432, 577, 633, 775, 632, 624, 683, 1086, 781, 1478, 3129, 2256, 2262, 3348, 2915, 3665, 2966, 3198, 4890, 4559, 3915, 4051, 3777, 4310, 6043, 6803, 8927, 10045, 9782, 9611, 10463, 9888, 10860, 10396, 8598, 7693, 7777, 9504, 12920, 15473, 14449, 12419, 13296, 12613, 12071, 12190, 13710, 13988, 13589, 13912, 13139, 17388, 13067, 14210, 13786, 13170, 14561, 15169, 16982, 17797, 17274, 19657, 20371, 21633, 25514, 28000, 30295, 25457, 35171, 56812, 31981, 26395, 24808, 27848, 24095, 25448, 23669, 22744, 21191, 23039, 22107, 21268, 22186, 22909, 19469, 18666, 18338, 18194, 16659, 16624, 15956, 16578, 16104, 14019, 12390, 12422, 7038, 5613, 6148, 4061, 3190, 2804, 2893, 2855, 3025, 2728, 3170, 5242, 4882, 3607, 3176, 2281, 1887, 1804, 1924, 1592, 1331, 1461, 1721, 1718, 1495, 1276, 1133, 962, 1047, 1031, 948, 820, 761, 812, 725, 600, 698, 819, 671, 638, 521], "status": 200, "timing_ms": {"backend": 21783, "total": 22012}, "total": {"baseline_pages": 23765561, "days": 54091, "first_day": 13401, "hits": 1412665, "last_day": 96422, "papers": 4073, "places": 1582}, "wall_s": 22.21},
    "bench: influenza 1918": {"bucket": {"count": 53, "from": "1918-01-01", "to": "1918-12-31", "unit": "week"}, "languages": {"cho": 58, "cze": 39, "dak": 4, "dan": 28, "eng": 51322, "fin": 1, "fre": 155, "ger": 928, "haw": 26, "ita": 487, "jpn": 6, "lit": 92, "nor": 168, "pol": 163, "spa": 984, "yid": 12}, "query": "q=influenza&mode=phrase&from=1918-01-01&to=1918-12-31", "series_hits": [29, 34, 40, 49, 34, 33, 36, 35, 34, 25, 38, 28, 25, 52, 38, 53, 40, 24, 20, 14, 19, 36, 24, 21, 33, 78, 81, 120, 98, 79, 36, 53, 77, 51, 32, 24, 148, 647, 1349, 2546, 4198, 4835, 4885, 4562, 3972, 3649, 3582, 3277, 3620, 3753, 3529, 2649, 353], "status": 200, "timing_ms": {"backend": 6814, "total": 6819}, "total": {"baseline_pages": 522046, "days": 358, "first_day": 79622, "hits": 53097, "last_day": 79986, "papers": 698, "places": 615}, "wall_s": 6.98},
    "bench: influenza GA front": {"bucket": {"count": 228, "from": "1736-09-03", "to": "1963-12-31", "unit": "year"}, "languages": {"eng": 854}, "query": "q=influenza&mode=phrase&state=GA&front=true", "series_hits": [0, 0, 0, 0, 0, 0, 0, 0, 0, 0, 0, 0, 0, 0, 0, 0, 0, 0, 0, 0, 0, 0, 0, 0, 0, 0, 0, 0, 0, 0, 0, 0, 0, 0, 0, 0, 0, 0, 0, 0, 0, 0, 0, 0, 0, 0, 0, 0, 0, 0, 0, 0, 0, 0, 0, 0, 0, 0, 0, 0, 0, 0, 0, 0, 0, 0, 0, 0, 0, 0, 0, 0, 0, 0, 0, 0, 0, 0, 0, 0, 0, 0, 0, 0, 0, 0, 0, 0, 0, 0, 0, 0, 0, 0, 0, 0, 0, 0, 0, 0, 0, 0, 0, 0, 0, 0, 0, 0, 0, 0, 0, 0, 0, 0, 0, 0, 0, 0, 0, 0, 0, 0, 0, 0, 0, 0, 0, 0, 0, 0, 0, 0, 0, 0, 0, 0, 0, 1, 0, 0, 0, 0, 0, 0, 0, 2, 1, 1, 0, 0, 1, 1, 0, 21, 46, 59, 27, 13, 3, 6, 0, 5, 7, 11, 9, 5, 9, 3, 9, 4, 0, 2, 1, 6, 5, 4, 3, 14, 3, 1, 3, 2, 150, 108, 79, 16, 49, 26, 20, 18, 5, 5, 2, 2, 0, 2, 2, 2, 0, 1, 2, 3, 2, 4, 2, 6, 1, 3, 1, 1, 1, 3, 0, 2, 1, 2, 1, 3, 1, 2, 3, 14, 3, 2, 4, 3, 4, 5], "status": 200, "timing_ms": {"backend": 10338, "total": 10338}, "total": {"days": 706, "first_day": 63546, "hits": 854, "last_day": 96131, "papers": 31, "places": 12}, "wall_s": 10.45},
    "bench: lincoln": {"bucket": {"count": 228, "from": "1736-09-03", "to": "1963-12-31", "unit": "year"}, "languages": {"cho": 576, "chr": 3, "cze": 5992, "dak": 97, "dan": 2189, "eng": 3339788, "fin": 844, "fre": 32107, "ger": 69557, "haw": 1261, "heb": 1, "hrv": 375, "hun": 614, "ice": 19, "ita": 6530, "jpn": 540, "lit": 1589, "nav": 17, "nor": 5963, "pol": 21933, "rum": 223, "slo": 297, "slv": 491, "spa": 41455, "srp": 478, "swe": 386, "yid": 3378}, "query": "q=lincoln&mode=phrase", "series_hits": [1, 3, 1, 1, 0, 0, 0, 0, 0, 0, 0, 0, 0, 0, 0, 3, 3, 0, 0, 0, 0, 3, 1, 1, 4, 5, 1, 1, 7, 4, 2, 2, 12, 7, 4, 13, 25, 9, 44, 28, 24, 37, 11, 158, 104, 42, 25, 23, 5, 12, 11, 107, 124, 47, 30, 41, 39, 97, 34, 105, 48, 121, 127, 89, 208, 192, 198, 130, 151, 84, 104, 110, 195, 169, 193, 196, 157, 158, 127, 138, 308, 191, 181, 315, 334, 352, 389, 441, 395, 500, 590, 522, 726, 973, 737, 496, 735, 714, 975, 436, 789, 702, 1041, 1201, 1673, 1236, 1118, 1549, 1419, 1243, 1527, 2082, 2424, 2011, 2250, 2345, 2492, 2862, 3355, 2846, 3094, 3862, 5718, 4489, 21308, 26990, 21459, 20183, 28451, 23310, 19912, 16893, 17584, 13326, 13497, 12631, 16536, 16123, 18478, 18152, 20592, 14927, 14458, 15352, 17969, 23228, 20661, 22041, 29186, 25081, 26641, 30602, 33023, 31645, 36580, 40396, 40849, 38733, 43431, 47710, 59550, 53860, 53460, 57575, 67579, 61121, 59871, 56871, 60153, 56463, 62274, 63940, 78775, 79972, 76746, 71735, 76260, 68642, 66114, 66734, 69224, 67042, 61714, 64514, 72755, 65252, 70300, 41555, 40337, 34621, 29826, 26425, 23429, 22919, 21321, 19969, 17465, 15158, 18464, 21642, 21096, 19661, 17258, 17405, 18922, 19800, 16454, 14309, 14601, 15047, 13931, 12654, 11995, 11262, 11048, 9978, 10645, 9770, 10834, 11110, 10085, 8846, 8188, 9614, 9257, 9187, 8783, 8597], "status": 200, "timing_ms": {"backend": 12102, "total": 12323}, "total": {"baseline_pages": 23765561, "days": 52331, "first_day": 13464, "hits": 3407696, "last_day": 96422, "papers": 4294, "places": 1636}, "wall_s": 14.4},
    "bench: miscegenation": {"bucket": {"count": 228, "from": "1736-09-03", "to": "1963-12-31", "unit": "year"}, "languages": {"cho": 2, "eng": 7703, "fre": 97, "ger": 27, "haw": 6, "jpn": 2, "spa": 16, "srp": 2}, "query": "q=miscegenation&mode=phrase", "series_hits": [0, 0, 0, 0, 0, 0, 0, 0, 0, 0, 0, 0, 0, 0, 0, 0, 0, 0, 0, 0, 0, 0, 0, 0, 0, 0, 0, 0, 0, 0, 0, 0, 0, 0, 0, 0, 0, 0, 0, 0, 0, 0, 0, 0, 0, 0, 0, 0, 0, 0, 0, 0, 0, 0, 0, 0, 0, 0, 0, 0, 0, 0, 0, 0, 0, 0, 0, 0, 0, 0, 0, 0, 0, 0, 0, 0, 0, 0, 0, 0, 0, 0, 0, 0, 0, 0, 0, 0, 0, 0, 0, 0, 0, 0, 0, 0, 0, 0, 0, 0, 0, 0, 0, 0, 0, 0, 0, 0, 0, 0, 0, 0, 0, 0, 0, 0, 0, 0, 0, 0, 0, 0, 0, 0, 0, 0, 0, 0, 669, 287, 273, 258, 297, 117, 119, 66, 63, 94, 134, 69, 57, 56, 84, 187, 100, 133, 97, 153, 229, 154, 119, 113, 71, 106, 69, 70, 72, 59, 61, 189, 66, 146, 132, 152, 81, 200, 126, 160, 90, 138, 71, 161, 128, 183, 109, 62, 71, 155, 39, 32, 36, 28, 12, 17, 25, 24, 23, 17, 26, 41, 36, 25, 14, 13, 3, 23, 15, 13, 18, 9, 13, 17, 9, 15, 4, 27, 16, 3, 11, 12, 16, 15, 17, 30, 12, 2, 3, 7, 6, 17, 24, 13, 10, 23, 16, 10, 3, 21], "status": 200, "timing_ms": {"backend": 9224, "total": 9380}, "total": {"baseline_pages": 23765561, "days": 5412, "first_day": 59921, "hits": 7717, "last_day": 96392, "papers": 1291, "places": 770}, "wall_s": 9.51},
    "bench: railroad": {"bucket": {"count": 228, "from": "1736-09-03", "to": "1963-12-31", "unit": "year"}, "languages": {"cho": 2879, "cze": 1591, "dak": 81, "dan": 861, "eng": 8251273, "fin": 90, "fre": 25607, "ger": 39410, "haw": 6343, "heb": 3, "hrv": 108, "hun": 88, "ice": 1, "ita": 4031, "jpn": 821, "lit": 76, "mus": 3, "nav": 25, "nor": 878, "pol": 1028, "rum": 116, "slo": 14, "slv": 96, "spa": 67207, "srp": 346, "swe": 809, "yid": 619}, "query": "q=railroad&mode=phrase", "series_hits": [0, 0, 0, 0, 0, 0, 0, 0, 0, 0, 0, 0, 0, 0, 0, 0, 0, 0, 0, 0, 0, 0, 0, 0, 0, 0, 0, 0, 0, 0, 0, 0, 0, 0, 0, 0, 0, 0, 0, 0, 0, 0, 0, 0, 0, 0, 0, 0, 0, 0, 0, 0, 0, 0, 0, 0, 0, 0, 0, 0, 0, 0, 0, 0, 0, 0, 0, 0, 0, 0, 0, 0, 0, 0, 0, 0, 0, 0, 0, 0, 0, 0, 0, 0, 0, 0, 1, 0, 0, 2, 8, 26, 43, 62, 104, 215, 158, 203, 374, 922, 1843, 1951, 2601, 3126, 2927, 4027, 6285, 6785, 6505, 9849, 9761, 8559, 9104, 11242, 14719, 19458, 21310, 27929, 30964, 30343, 32795, 34742, 35359, 39904, 40423, 37556, 37650, 33641, 36155, 35404, 47101, 48570, 50129, 53406, 53115, 55998, 61483, 68555, 65427, 65800, 63088, 59951, 59920, 61395, 66557, 74078, 73778, 80296, 83321, 84818, 91868, 103933, 101985, 104844, 119086, 127328, 123678, 124632, 130934, 135845, 142808, 159133, 153529, 168569, 170838, 170941, 185407, 184421, 183034, 197690, 207688, 206566, 190583, 196174, 204920, 179709, 180655, 177470, 174308, 157109, 163931, 148386, 132892, 146448, 142019, 130284, 135663, 60631, 51175, 43270, 35610, 31284, 23372, 25461, 21981, 21365, 18904, 16917, 18759, 19389, 19061, 16391, 13882, 12605, 12895, 15157, 14193, 14609, 13223, 13615, 11577, 9120, 8140, 7466, 7224, 6561, 6348, 6493, 6003, 5867, 5032, 4277, 4354, 4272, 4236, 3885, 4095, 4061], "status": 200, "timing_ms": {"backend": 11698, "total": 12072}, "total": {"baseline_pages": 23765561, "days": 46499, "first_day": 44912, "hits": 8269889, "last_day": 96422, "papers": 4343, "places": 1640}, "wall_s": 14.27},